{
  "schema_version": "1.0",
  "trace_id": "synthetic-defective-001",
  "synthetic": true,
  "reported_outcome": "success",
  "events": [
    {
      "event_id": "start",
      "sequence": 0,
      "type": "start",
      "timestamp": "2026-10-16T10:00:00Z"
    },
    {
      "event_id": "call",
      "sequence": 1,
      "type": "tool_call",
      "call_id": "c1",
      "tool_name": "retrieve_document",
      "timestamp": "2026-10-16T10:00:01Z"
    },
    {
      "event_id": "result",
      "sequence": 2,
      "type": "tool_result",
      "call_id": "orphan",
      "status": "error",
      "timestamp": "2026-10-16T10:00:02Z",
      "text": "Synthetic document retrieved."
    },
    {
      "event_id": "claim",
      "sequence": 1,
      "type": "claim",
      "timestamp": "2026-10-16T09:00:00Z",
      "evidence": [
        {
          "kind": "event",
          "ref": "missing"
        },
        {
          "kind": "external",
          "ref": "https://example.invalid/synthetic"
        }
      ]
    },
    {
      "event_id": "end",
      "sequence": 4,
      "type": "end",
      "timestamp": "2026-10-16T10:00:04Z"
    }
  ],
  "artifacts": [
    {
      "artifact_id": "a1",
      "path": "demo.txt",
      "sha256": "0000000000000000000000000000000000000000000000000000000000000000",
      "source_event_id": "result"
    }
  ]
}
